{
  "site": {
    "domain": "https://www.bembelracingteam.de",
    "name": "Bembel Racing Team",
    "language": "de-DE",
    "locale": "de_DE",
    "author": "Bembel Racing Team",
    "themeColor": "#0f1114",
    "formatDetection": "telephone=no",
    "referrer": "strict-origin-when-cross-origin",
    "ogImage": {
      "url": "https://www.bembelracingteam.de/assets/img/og-cover.jpg",
      "secureUrl": "https://www.bembelracingteam.de/assets/img/og-cover.jpg",
      "type": "image/jpeg",
      "alt": "Renn-Trabi Enke 666 in Schwarz und Orange",
      "width": 1200,
      "height": 630
    },
    "assets": {
      "teamImage": "https://www.bembelracingteam.de/assets/img/trabi.jpg",
      "logo512": "https://www.bembelracingteam.de/assets/img/favicon-512x512.png",
      "appleTouchIcon": "assets/img/apple-touch-icon.png",
      "favicon32": "assets/img/favicon-32x32.png",
      "favicon16": "assets/img/favicon-16x16.png",
      "faviconSvg": "assets/img/favicon.svg"
    },
    "social": {
      "instagramWebUrl": "https://www.instagram.com/bembelracingteam/",
      "instagramAppUrl": "instagram://user?username=bembelracingteam"
    }
  },
  "mainpageConfig": {
    "hero": {
      "badge": "Saison 2026 ‚Ä¢ Trabi-Rennen Sachsen",
      "lead": "Wir sind ein kleines Rennteam und gehen dieses Jahr in Sachsen an den Start. Hier findest du Updates, Fahrzeugdetails, Sponsoren und wie du uns supporten kannst.",
      "stats": {
        "raceCars": 1,
        "raceCarsLabel": "Renn-Trabi",
        "crewCount": 3,
        "crewLabel": "Crew",
        "season": 2026,
        "seasonLabel": "Saison"
      }
    },
    "race": {
      "heading": "Trabi-Rennen Sachsen",
      "startLocal": "2026-08-15T10:00:00",
      "location": "Sachsen",
      "eventName": "Trabi-Rennen",
      "region": "Sachsen",
      "startWindow": "10:00 Uhr ‚Ä¢ Sprintlauf",
      "statusUpcoming": "In Vorbereitung",
      "statusLive": "Live / l√§uft",
      "className": "2-Takt Fun Cup",
      "crew": "3 Fahrer + Boxencrew",
      "pitSlot": "Box 12",
      "goal": "Finish + saubere Pace",
      "roadmap": [
        {
          "task": "Wartung & Sicherheitscheck",
          "date": "06.08",
          "state": "done"
        },
        {
          "task": "Testlauf + Fahrwerks-Feintuning",
          "date": "07.08",
          "state": "done"
        },
        {
          "task": "Transport, Pit-Setup, Abnahme",
          "date": "14.08",
          "state": "active"
        },
        {
          "task": "Rennwochenende & Race Day",
          "date": "15.08",
          "state": ""
        }
      ]
    },
    "ticker": [
      "‚öôÔ∏è Setup: Fahrwerk feinjustiert",
      "üß∞ Pit-Gear: Checkliste aktualisiert",
      "üèÅ Ziel: sauberer Lauf, keine DNFs",
      "üî• ‚ÄûEnke 666‚Äú ready to race"
    ],
    "contact": {
      "primaryEmail": "kontakt@bembelracingteam.de",
      "footerEmail": "info@bembelracingteam.de",
      "formMailTo": "kontakt@bembelracingteam.de",
      "locationLabel": "Unterwegs ‚Ä¢ Sachsen 2026",
      "instagram": {
        "handle": "@bembelracingteam",
        "webUrl": "https://www.instagram.com/bembelracingteam/",
        "appUrl": "instagram://user?username=bembelracingteam"
      }
    },
    "joinModal": {
      "badge": "Team-Update",
      "title": "Aktuell sind alle Teampl√§tze vergeben.",
      "bodyMain": "Danke f√ºr dein Interesse am Mitmachen. Im Moment haben wir leider keine freien Pl√§tze im Team.",
      "bodySoft": "Wenn du uns trotzdem unterst√ºtzen m√∂chtest, freuen wir uns sehr √ºber Sponsoring.",
      "ctaHref": "/sponsoring-anfrage.html",
      "ctaLabel": "Sponsoring anfragen"
    },
    "raceCenter": {
      "summary": {
        "state": "In Vorbereitung",
        "nextMilestone": "Transport, Pit-Setup und Abnahme",
        "lastUpdateAt": ""
      },
      "feed": [
        {
          "id": "manual-setup-check",
          "category": "technik",
          "title": "Setup-Check abgeschlossen",
          "body": "Bremsbalance stabil, Temperaturfenster passt fuer den Testlauf.",
          "at": "2026-08-06T18:00:00+02:00",
          "reactions": {
            "fire": 0,
            "checkered": 0,
            "wrench": 0
          }
        },
        {
          "id": "manual-pit-ablauf",
          "category": "team",
          "title": "Pit-Ablauf geprobt",
          "body": "Tool-Positionen angepasst, Boxenfenster weiter verbessert.",
          "at": "2026-08-07T20:10:00+02:00",
          "reactions": {
            "fire": 0,
            "checkered": 0,
            "wrench": 0
          }
        },
        {
          "id": "manual-anreise",
          "category": "rennen",
          "title": "Anreisefenster fix",
          "body": "Transport und Abnahme fuer den Vorabend finalisiert.",
          "at": "2026-08-14T19:30:00+02:00",
          "reactions": {
            "fire": 0,
            "checkered": 0,
            "wrench": 0
          }
        }
      ],
      "polls": [
        {
          "id": "manual-focus-poll",
          "question": "Was soll im naechsten Update im Fokus stehen?",
          "options": [
            {
              "id": "pace",
              "label": "Pace pushen",
              "votes": 0
            },
            {
              "id": "safety",
              "label": "Safety zuerst",
              "votes": 0
            },
            {
              "id": "stops",
              "label": "Pit-Stops optimieren",
              "votes": 0
            }
          ]
        }
      ]
    }
  },
  "sponsoringConfig": {
    "mailTo": "sponsoring@bembelracingteam.de",
    "defaultPlan": "Bronze",
    "defaultAmount": 1200,
    "amountRange": {
      "min": 300,
      "max": 5000,
      "step": 50
    },
    "amountChips": [
      600,
      1200,
      2500,
      4000
    ],
    "planMeta": {
      "Bronze": {
        "minAmount": 450,
        "visibility": "Website + Update-Erw√§hnung",
        "note": "Solider Einstieg mit klarer Sichtbarkeit in der Community."
      },
      "Silber": {
        "minAmount": 1100,
        "visibility": "Website + Fahrzeugbereich + Content",
        "note": "Ausgewogene Mischung aus Reichweite und Markenpr√§senz."
      },
      "Gold": {
        "minAmount": 2200,
        "visibility": "Prominente Platzierung + Co-Branding",
        "note": "Maximale Sichtbarkeit und enge Zusammenarbeit."
      }
    },
    "metrics": {
      "partnerSlots": {
        "used": 7,
        "total": 12
      },
      "budgetPercent": 68,
      "targetSeason": 2026,
      "fundingPercent": 68
    },
    "impactRules": {
      "starterMax": 899,
      "goodMax": 2199,
      "strongMax": 3499,
      "slotsDivisor": 150,
      "slotsMin": 3,
      "tags": {
        "starter": "Starter-Sichtbarkeit",
        "good": "Gute Strecken-Sichtbarkeit",
        "strong": "Starker Markenauftritt",
        "headline": "Headline-Partner Potenzial"
      }
    }
  },
  "seoPages": {
    "index": {
      "path": "/",
      "title": "Bembel Racing Team ‚Äì Renn-Trabi ‚ÄûEnke 666‚Äú",
      "description": "Kleines Rennteam, gro√üer Spa√ü: Unser Renn-Trabi ‚ÄûEnke 666‚Äú startet dieses Jahr beim Trabi-Rennen in Sachsen. News, Team, Fahrzeugdaten, Sponsoren & Kontakt.",
      "robots": "index,follow,max-snippet:-1,max-image-preview:large,max-video-preview:-1",
      "googlebot": "index,follow,max-snippet:-1,max-image-preview:large,max-video-preview:-1",
      "og": {
        "title": "Bembel Racing Team ‚Äì Renn-Trabi ‚ÄûEnke 666‚Äú",
        "description": "Wir starten dieses Jahr beim Trabi-Rennen in Sachsen. Folge unserem Projekt!",
        "type": "website"
      },
      "twitter": {
        "card": "summary_large_image",
        "title": "Bembel Racing Team ‚Äì Renn-Trabi ‚ÄûEnke 666‚Äú",
        "description": "Kleines Rennteam, gro√üer Spa√ü: News, Team, Fahrzeugdaten, Sponsoren und Kontakt."
      },
      "jsonLd": {
        "@context": "https://schema.org",
        "@graph": [
          {
            "@type": "SportsTeam",
            "@id": "https://www.bembelracingteam.de/#organization",
            "name": "Bembel Racing Team",
            "url": "https://www.bembelracingteam.de/",
            "image": "https://www.bembelracingteam.de/assets/img/trabi.jpg",
            "logo": "https://www.bembelracingteam.de/assets/img/favicon-512x512.png",
            "description": "Kleines Rennteam rund um den Renn-Trabi Enke 666 mit Fokus auf das Trabi-Rennen in Sachsen 2026.",
            "email": "kontakt@bembelracingteam.de",
            "sport": "Motorsport",
            "contactPoint": [
              {
                "@type": "ContactPoint",
                "contactType": "customer support",
                "email": "kontakt@bembelracingteam.de",
                "availableLanguage": [
                  "de"
                ]
              }
            ],
            "sameAs": [
              "https://www.instagram.com/bembelracingteam/"
            ]
          },
          {
            "@type": "WebSite",
            "@id": "https://www.bembelracingteam.de/#website",
            "url": "https://www.bembelracingteam.de/",
            "name": "Bembel Racing Team",
            "inLanguage": "de-DE",
            "publisher": {
              "@id": "https://www.bembelracingteam.de/#organization"
            }
          },
          {
            "@type": "WebPage",
            "@id": "https://www.bembelracingteam.de/#webpage",
            "url": "https://www.bembelracingteam.de/",
            "name": "Bembel Racing Team ‚Äì Renn-Trabi Enke 666",
            "description": "Kleines Rennteam, gro√üer Spa√ü: News, Team, Fahrzeugdaten, Sponsoren und Kontakt.",
            "inLanguage": "de-DE",
            "isPartOf": {
              "@id": "https://www.bembelracingteam.de/#website"
            },
            "about": {
              "@id": "https://www.bembelracingteam.de/#organization"
            },
            "primaryImageOfPage": {